id,name,model_id:id,group_id:id,perm_read,perm_write,perm_create,perm_unlink
access_wika_berita_acara_pembayaran, Berita Acara Pembayaran,model_wika_berita_acara_pembayaran,,1,1,1,1
access_wika_berita_acara_pembayaran_line, Berita Acara Pembayaran Line,model_wika_berita_acara_pembayaran_line,,1,1,1,1
access_wika_bap_document_line, Document Line,model_wika_bap_document_line,,1,1,1,1
access_wika_bap_approval_line, Approval History Line,model_wika_bap_approval_line,,1,1,1,1
access_reject_wizard, Reject Wizard,model_reject_wizard,,1,1,1,1
access_wika_bap_pricecut_line, Wika BAP Pricecut Line,model_wika_bap_pricecut_line,,1,1,1,1